name,path,category,role,description,rationale,integrationStrategy,status,date,commit
julie,external/unsorted/julie,Other,Submodule,"Submodule at external/unsorted/julie (Version: v1.2.0-1-g6876b08)",Project dependency,Git Submodule,Active,2026-01-06 18:44:44 -0500,6876b08772cd3dee3fb5289c0e0b7f560c8aaffc
khoj,external/unsorted/khoj,Other,Submodule,"Submodule at external/unsorted/khoj (Version: 2.0.0-beta.24-3-g9cbf620e)",Project dependency,Git Submodule,Active,2026-01-06 12:14:08 -0800,9cbf620e45e4f2d589fa0d51121a902334edf1fa
kreuzberg,external/unsorted/kreuzberg,Other,Submodule,"Submodule at external/unsorted/kreuzberg (Version: v4.0.5-4-ge68e72f5)",Project dependency,Git Submodule,Active,2026-01-14 15:57:16 +0100,e68e72f5c7da1f5dd8dfcb349b90874f0ceb8aba
langchain,external/unsorted/langchain,Other,Submodule,"Submodule at external/unsorted/langchain (Version: langchain-tests==0.3.14-2326-g3899154daf)",Project dependency,Git Submodule,Active,2026-01-14 16:38:33 -0500,3899154daf9fcbcf3f2dc377d0528ab5bcbf5a29
lar,external/unsorted/lar,Other,Submodule,"Submodule at external/unsorted/lar (Version: v1.1.1-2-g4681e18)",Project dependency,Git Submodule,Active,2026-01-14 02:37:07 +0000,4681e1826563bb5f9eacb2b7e4c773cb001f89f4
lazy-mcp,external/unsorted/lazy-mcp,Other,Submodule,"Submodule at external/unsorted/lazy-mcp (Version: v0.5.4-2-ga9928c8)",Project dependency,Git Submodule,Active,2025-10-15 10:25:20 -0700,a9928c8e00fbc6eef530d7d747427df75b5d32a6
lcpfs,external/unsorted/lcpfs,Other,Submodule,"Submodule at external/unsorted/lcpfs (Version: heads/main)",Project dependency,Git Submodule,Active,2026-01-03 01:41:05 +0100,398026f7c8f7f6b297673db3721b47c68c8bcaa8
learn-claude-code,external/unsorted/learn-claude-code,Other,Submodule,"Submodule at external/unsorted/learn-claude-code (Version: heads/main)",Project dependency,Git Submodule,Active,2026-01-08 01:02:22 +0800,65e26083de0f8d42d6ab159413fa91653ffa5396
liballocs,external/unsorted/liballocs,Other,Submodule,"Submodule at external/unsorted/liballocs (Version: default/master-1374-gb0fe8fd)",Project dependency,Git Submodule,Active,2026-01-14 13:29:30 +0000,b0fe8fd259436d991743bf6862d4ae9046e7a38f
license-generator,external/unsorted/license-generator,Other,Submodule,"Submodule at external/unsorted/license-generator (Version: v0.4.1)",Project dependency,Git Submodule,Active,2026-01-03 23:44:38 -0500,134205438791e30974175e32b6d4b658d45d2f91
linggen,external/unsorted/linggen,Other,Submodule,"Submodule at external/unsorted/linggen (Version: 0.5.2-1-g5c8bd85)",Project dependency,Git Submodule,Active,2026-01-14 14:04:29 -0400,5c8bd8557e0aae974fa05bf6c0ac218e99209f0b
live,external/unsorted/live,Other,Submodule,"Submodule at external/unsorted/live (Version: heads/main)",Project dependency,Git Submodule,Active,2024-03-25 11:10:58 +0000,01b7b07151b4abcb0529d1f6dc7a01f0d7ef0e09
llm-bridge,external/unsorted/llm-bridge,Other,Submodule,"Submodule at external/unsorted/llm-bridge (Version: heads/main)",Project dependency,Git Submodule,Active,2025-10-31 09:49:50 -0700,d64807543321b6e72d91a6576ced9affd0d2f769
llm-council,external/unsorted/llm-council,Other,Submodule,"Submodule at external/unsorted/llm-council (Version: heads/master)",Project dependency,Git Submodule,Active,2025-11-22 15:35:19 -0800,92e1fccb1bdcf1bab7221aa9ed90f9dc72529131
logicstamp-context,external/unsorted/logicstamp-context,Other,Submodule,"Submodule at external/unsorted/logicstamp-context (Version: v0.3.2-11-ge8c8e74)",Project dependency,Git Submodule,Active,2026-01-14 15:35:37 +0200,e8c8e743e68669639a74a8d5c66a596e8ec8f90b
magg,external/unsorted/magg,Other,Submodule,"Submodule at external/unsorted/magg (Version: v0.10.1)",Project dependency,Git Submodule,Active,2025-08-06 18:39:44 -0700,c237d4c12e30e2d3e2ab8d209ee26bf47f848489
mcp-chat-studio,external/unsorted/mcp-chat-studio,Other,Submodule,"Submodule at external/unsorted/mcp-chat-studio (Version: heads/main)",Project dependency,Git Submodule,Active,2026-01-07 01:23:32 +0100,53abbfcc7724132ae83420044a8deb212fa84546
mcp-cli,external/unsorted/mcp-cli,Other,Submodule,"Submodule at external/unsorted/mcp-cli (Version: v0.1.7-7-gfa32257)",Project dependency,Git Submodule,Active,2026-01-13 15:33:08 +0100,fa32257e92e9389394598f999fa096b03c45b1d9
mcp-reticle,external/unsorted/mcp-reticle,Other,Submodule,"Submodule at external/unsorted/mcp-reticle (Version: v0.1.0-rc.7-4-g37b1517)",Project dependency,Git Submodule,Active,2026-01-06 14:48:29 +0400,37b1517ea7e3f1bf65f5ebc2d1217670f9a55698
mcp-tui-driver,external/unsorted/mcp-tui-driver,Other,Submodule,"Submodule at external/unsorted/mcp-tui-driver (Version: heads/main)",Project dependency,Git Submodule,Active,2026-01-12 20:39:07 +0800,6d3eb4c5be76854f2d464852f461d5377320cd63
mcp-tui-server,external/unsorted/mcp-tui-server,Other,Submodule,"Submodule at external/unsorted/mcp-tui-server (Version: heads/main)",Project dependency,Git Submodule,Active,2026-01-12 20:39:07 +0800,6d3eb4c5be76854f2d464852f461d5377320cd63
mcpdir,external/unsorted/mcpdir,Other,Submodule,"Submodule at external/unsorted/mcpdir (Version: heads/main)",Project dependency,Git Submodule,Active,2026-01-11 23:10:01 +0300,4452d1a626a96a81bf846d1e74c321ffd900f10b
mcphub,external/unsorted/mcphub,Other,Submodule,"Submodule at external/unsorted/mcphub (Version: v0.12.0)",Project dependency,Git Submodule,Active,2026-01-14 19:17:10 +0800,043fcb53b5e6ba9939c6334e109e79353b91326a
mcpproxy-go,external/unsorted/mcpproxy-go,Other,Submodule,"Submodule at external/unsorted/mcpproxy-go (Version: v0.14.0)",Project dependency,Git Submodule,Active,2026-01-14 18:53:45 +0200,50e5bb87726c5e7b015a0f39c90300e92487416a
mcpr,external/unsorted/mcpr,Other,Submodule,"Submodule at external/unsorted/mcpr (Version: heads/main)",Project dependency,Git Submodule,Active,2026-01-12 21:00:17 +0100,1298d44a0db315c5cb1f4f77187d09d19654dc48
memU,external/unsorted/memU,Other,Submodule,"Submodule at external/unsorted/memU (Version: v1.2.0)",Project dependency,Git Submodule,Active,2026-01-14 23:58:15 +0900,a4cff91eba0ceb4213c378ddc5f0e72ec90a9a2a
memex,external/unsorted/memex,Other,Submodule,"Submodule at external/unsorted/memex (Version: v0.2.4)",Project dependency,Git Submodule,Active,2026-01-12 04:25:17 -0800,2bca223ff1673d0d94ba81b84d5b8c32f6e8c460
memos,external/unsorted/memos,Other,Submodule,"Submodule at external/unsorted/memos (Version: v0.25.3-189-gf600fffe)",Project dependency,Git Submodule,Active,2026-01-14 23:56:27 +0800,f600fffe93af47f4b276a5b146740a952d603a1e
memvid,external/unsorted/memvid,Other,Submodule,"Submodule at external/unsorted/memvid (Version: v2.0.131-67-g6b92447)",Project dependency,Git Submodule,Active,2026-01-14 16:50:51 -0500,6b924470ff92b353ef98f42662e00b7e60b14f93
metube,external/unsorted/metube,Other,Submodule,"Submodule at external/unsorted/metube (Version: 2026.01.11)",Project dependency,Git Submodule,Active,2026-01-11 20:38:06 +0200,b179535711a2014f4f0834b67bb4360375202cca
misc-text,external/unsorted/misc-text,Other,Submodule,"Submodule at external/unsorted/misc-text (Version: heads/main)",Project dependency,Git Submodule,Active,2026-01-06 22:36:52 -0300,685cf707046d5d4337689918c06f77760d0fd2a0
mux,external/unsorted/mux,Other,Submodule,"Submodule at external/unsorted/mux (Version: v0.12.2-34-g16c1591f)",Project dependency,Git Submodule,Active,2026-01-14 21:13:21 +0000,16c1591f4b4b11abfaf9d98015ce4be5fb6ed426
mystats,external/unsorted/mystats,Other,Submodule,"Submodule at external/unsorted/mystats (Version: heads/main)",Project dependency,Git Submodule,Active,2026-01-09 04:39:56 +0900,7957f523cc1b6f2b8f31154d1a76b196aa99e1fe
nanovg,external/unsorted/nanovg,Other,Submodule,"Submodule at external/unsorted/nanovg (Version: heads/master)",Project dependency,Git Submodule,Active,2023-08-26 16:32:21 -0700,f93799c078fa11ed61c078c65a53914c8782c00b
newsnow,external/unsorted/newsnow,Other,Submodule,"Submodule at external/unsorted/newsnow (Version: v0.0.39-2-g951241b)",Project dependency,Git Submodule,Active,2025-12-27 15:23:50 +0000,951241bf1be2b09d6e7b0ac8aa63a251ecc2e2b8
notebooklm-kit,external/unsorted/notebooklm-kit,Other,Submodule,"Submodule at external/unsorted/notebooklm-kit (Version: v2.2.0-3-g3ced31e)",Project dependency,Git Submodule,Active,2026-01-14 03:07:49 +0000,3ced31e328bdc7b108be00d2be56261a24ec43b9
nuclear,external/unsorted/nuclear,Other,Submodule,"Submodule at external/unsorted/nuclear (Version: v0.6.19-1283-gd55bd753)",Project dependency,Git Submodule,Active,2025-11-06 17:53:31 +0100,d55bd7533392b249174b22d6e960ba07143afa48
nucleus,external/unsorted/nucleus,Other,Submodule,"Submodule at external/unsorted/nucleus (Version: heads/main)",Project dependency,Git Submodule,Active,2026-01-12 18:15:11 -0700,0a052f00d749101efca7a60735bbff410f91d28c
obsidian-releases,external/unsorted/obsidian-releases,Other,Submodule,"Submodule at external/unsorted/obsidian-releases (Version: v1.11.4-6-g2562f436)",Project dependency,Git Submodule,Active,2026-01-14 00:30:33 +0000,2562f436f345150c3b1be81f467c243637444e94
open-skills,external/unsorted/open-skills,Other,Submodule,"Submodule at external/unsorted/open-skills (Version: heads/main)",Project dependency,Git Submodule,Active,2025-12-10 22:26:26 +0530,269f75f16e2e7a8c726a25a33dfcdb5c5d892397
open-webui,external/unsorted/open-webui,Other,Submodule,"Submodule at external/unsorted/open-webui (Version: v0.7.2)",Project dependency,Git Submodule,Active,2026-01-11 01:00:01 +0400,2b26355002064228e9b671339f8f3fb9d1fafa73
openchamber,external/unsorted/openchamber,Other,Submodule,"Submodule at external/unsorted/openchamber (Version: v1.4.9-2-gdf98b3e)",Project dependency,Git Submodule,Active,2026-01-14 22:34:17 +0200,df98b3e3e14d2c39bde42836ef782ae3fee3a389
opencode-antigravity-auth,external/unsorted/opencode-antigravity-auth,Other,Submodule,"Submodule at external/unsorted/opencode-antigravity-auth (Version: v1.2.9-beta.0-11-g83ea312)",Project dependency,Git Submodule,Active,2026-01-11 09:51:07 +0700,83ea312d9167b11fe5aa1f40bb676d841ae30987
opencode-dynamic-context-pruning,external/unsorted/opencode-dynamic-context-pruning,Other,Submodule,"Submodule at external/unsorted/opencode-dynamic-context-pruning (Version: v1.2.1)",Project dependency,Git Submodule,Active,2026-01-14 01:43:47 -0500,922ef1781eb0c08eef75875ac6f0d8acd0c69939
opencode-gemini-auth,external/unsorted/opencode-gemini-auth,Other,Submodule,"Submodule at external/unsorted/opencode-gemini-auth (Version: v1.3.7)",Project dependency,Git Submodule,Active,2026-01-06 18:38:08 +0100,365691a58442878b1eb299a93f0e3554ee369033
opencode-google-antigravity-auth,external/unsorted/opencode-google-antigravity-auth,Other,Submodule,"Submodule at external/unsorted/opencode-google-antigravity-auth (Version: v0.2.13-1-g815f95f)",Project dependency,Git Submodule,Active,2026-01-12 23:47:12 +0200,815f95f1d355f6b106475381d7d35adcef2ea700
opencode-md-table-formatter,external/unsorted/opencode-md-table-formatter,Other,Submodule,"Submodule at external/unsorted/opencode-md-table-formatter (Version: v0.0.3-3-g24b7ce2)",Project dependency,Git Submodule,Active,2025-12-09 15:38:34 +0100,24b7ce20f1abdd41a7fd246f0e420f2d89d26619
opencode-morph-fast-apply,external/unsorted/opencode-morph-fast-apply,Other,Submodule,"Submodule at external/unsorted/opencode-morph-fast-apply (Version: heads/trunk)",Project dependency,Git Submodule,Active,2025-12-22 17:16:30 -0500,08b54623ec5c3520117e405384ac932b622a836e
opencode-notificator,external/unsorted/opencode-notificator,Other,Submodule,"Submodule at external/unsorted/opencode-notificator (Version: heads/main)",Project dependency,Git Submodule,Active,2025-12-29 22:46:30 +0100,467da26311e41507bcb3cdc3c5cb032ee7ad15bf
opencode-notifier,external/unsorted/opencode-notifier,Other,Submodule,"Submodule at external/unsorted/opencode-notifier (Version: v0.1.13)",Project dependency,Git Submodule,Active,2026-01-14 18:08:47 +0530,46838542008a4b03298bdfdfe75f152dacbb5a5b
opencode-openai-codex-auth,external/unsorted/opencode-openai-codex-auth,Other,Submodule,"Submodule at external/unsorted/opencode-openai-codex-auth (Version: v4.2.0-14-gbec2ad6)",Project dependency,Git Submodule,Active,2026-01-09 14:00:33 +0000,bec2ad69b252ef4ad7dd33b9532ff8b4fdb6d016
opencode-plugin-template,external/unsorted/opencode-plugin-template,Other,Submodule,"Submodule at external/unsorted/opencode-plugin-template (Version: heads/main)",Project dependency,Git Submodule,Active,2026-01-12 07:58:26 +1030,9e002a4ed996a8c858913278cb8b216686ba6cbd
opencode-plugins,external/unsorted/opencode-plugins,Other,Submodule,"Submodule at external/unsorted/opencode-plugins (Version: opencode-plugin-copilot@0.0.6)",Project dependency,Git Submodule,Active,2025-09-09 16:56:01 +0700,f65469abd5e9bfbf473540cdc7ec18915d1c3eed
opencode-pty,external/unsorted/opencode-pty,Other,Submodule,"Submodule at external/unsorted/opencode-pty (Version: v0.1.4)",Project dependency,Git Submodule,Active,2026-01-08 17:33:40 +0200,46d0605ea987a8793bbf2df12a8165f4b01e2043
opencode-shell-strategy,external/unsorted/opencode-shell-strategy,Other,Submodule,"Submodule at external/unsorted/opencode-shell-strategy (Version: heads/trunk)",Project dependency,Git Submodule,Active,2026-01-06 19:32:57 -0500,4f137ed7c8d0394e50c9ecb310b78be43e8a7f35
opencode-skillful,external/unsorted/opencode-skillful,Other,Submodule,"Submodule at external/unsorted/opencode-skillful (Version: v1.2.3)",Project dependency,Git Submodule,Active,2026-01-03 19:03:02 +1030,8e34c82dba4302cc980bc2cb929bb9af441bb52c
opencode-skills,external/unsorted/opencode-skills,Other,Submodule,"Submodule at external/unsorted/opencode-skills (Version: v0.0.2-43-g5579eff)",Project dependency,Git Submodule,Active,2025-12-23 05:52:40 +0300,5579effe2d88524092e0353fb66c48fe7b9975bc
opencode-supermemory,external/unsorted/opencode-supermemory,Other,Submodule,"Submodule at external/unsorted/opencode-supermemory (Version: heads/main)",Project dependency,Git Submodule,Active,2026-01-06 00:12:02 +0530,ea0ac6108d0817b7be4d094f6073dbce2a0e6205
opencode-type-inject,external/unsorted/opencode-type-inject,Other,Submodule,"Submodule at external/unsorted/opencode-type-inject (Version: v1.3.1)",Project dependency,Git Submodule,Active,2025-12-18 15:30:09 +0200,bc48d0db4edf5bc8fb210cd3e4efa2cc16e2fb95
opencode-wakatime,external/unsorted/opencode-wakatime,Other,Submodule,"Submodule at external/unsorted/opencode-wakatime (Version: v1.1.1-2-g6383fa9)",Project dependency,Git Submodule,Active,2026-01-09 17:04:51 +0100,6383fa9b953d65aab45c3a625a4785d33e277828
opencode-websearch-cited,external/unsorted/opencode-websearch-cited,Other,Submodule,"Submodule at external/unsorted/opencode-websearch-cited (Version: v1.2.0)",Project dependency,Git Submodule,Active,2026-01-10 19:48:56 +0800,65e32672bccabaa18396229934193d6c3ea7c97c
openevolve,external/unsorted/openevolve,Other,Submodule,"Submodule at external/unsorted/openevolve (Version: v0.2.25-2-g75bc298)",Project dependency,Git Submodule,Active,2025-12-24 10:58:18 +0530,75bc29894b188b2434bf32c0db601f9dfbb41d5f
pal-mcp-server,external/unsorted/pal-mcp-server,Other,Submodule,"Submodule at external/unsorted/pal-mcp-server (Version: v9.8.2-1-g7afc7c1)",Project dependency,Git Submodule,Active,2025-12-15 17:07:31 +0000,7afc7c1cc96e23992c8f105f960132c657883bb1
pktai,external/unsorted/pktai,Other,Submodule,"Submodule at external/unsorted/pktai (Version: heads/main)",Project dependency,Git Submodule,Active,2025-08-12 20:51:17 -0400,49704ae989602bce9aee332b30732b8319805eb2
playwriter,external/unsorted/playwriter,Other,Submodule,"Submodule at external/unsorted/playwriter (Version: playwriter@0.0.47-2-g415c9f8)",Project dependency,Git Submodule,Active,2026-01-14 17:56:37 +0100,415c9f839f44557fa6c2248f08976520b59f1537
pluggedin-app,external/unsorted/pluggedin-app,Other,Submodule,"Submodule at external/unsorted/pluggedin-app (Version: v2.20.1)",Project dependency,Git Submodule,Active,2026-01-07 20:37:52 +0300,489d25a61bcfc3e80239926e9d13e75257cd63a2
portal,external/unsorted/portal,Other,Submodule,"Submodule at external/unsorted/portal (Version: cli-v0.1.24)",Project dependency,Git Submodule,Active,2026-01-06 17:58:14 +0530,15ca42c7adab79f4fc54b610b037f12aa4e54d69
postiz-app,external/unsorted/postiz-app,Other,Submodule,"Submodule at external/unsorted/postiz-app (Version: v0.0.1-2101-g0af727e0)",Project dependency,Git Submodule,Active,2026-01-14 16:32:05 +0700,0af727e0cfb067695f97156fa72fe1438307656c
promptflow,external/unsorted/promptflow,Other,Submodule,"Submodule at external/unsorted/promptflow (Version: v1.0.2-tools-1381-ga7ff42803)",Project dependency,Git Submodule,Active,2025-12-22 23:31:46 -0800,a7ff428032966087fe9bb2b498fb745e2c0eda5c
proofloop,external/unsorted/proofloop,Other,Submodule,"Submodule at external/unsorted/proofloop (Version: v1.0.2-10-g81d460d)",Project dependency,Git Submodule,Active,2026-01-12 21:17:22 +0200,81d460ddd9faa1b26882059f0e9c2e8fc1fcabb6
quartz,external/unsorted/quartz,Other,Submodule,"Submodule at external/unsorted/quartz (Version: v4.5.2-40-gf346a01)",Project dependency,Git Submodule,Active,2026-01-08 09:54:41 +0800,f346a01296e5bdbd19de38fa69968b42629b883d
quickadd,external/unsorted/quickadd,Other,Submodule,"Submodule at external/unsorted/quickadd (Version: 0.5.5-650-gbfffd46)",Project dependency,Git Submodule,Active,2026-01-12 17:02:07 +0100,bfffd460e2799ac6c8db021c961aa8c0d5874071
quivr,external/unsorted/quivr,Other,Submodule,"Submodule at external/unsorted/quivr (Version: core-0.0.33-29-g947a78541)",Project dependency,Git Submodule,Active,2025-06-19 15:02:37 +0200,947a785415c6c35ab2ae8157222b4720b0710b4d
ragflow,external/unsorted/ragflow,Other,Submodule,"Submodule at external/unsorted/ragflow (Version: nightly)",Project dependency,Git Submodule,Active,2026-01-14 19:08:46 +0800,678a4f959cd2c6a8aa5e76f270b682875e638d4a
reag,external/unsorted/reag,Other,Submodule,"Submodule at external/unsorted/reag (Version: heads/main)",Project dependency,Git Submodule,Active,2025-02-12 16:26:36 +0100,de230c74f31c8d6ad3f7c061ee58af3c554f288a
refact,external/unsorted/refact,Other,Submodule,"Submodule at external/unsorted/refact (Version: server/v1.11.2-317-g3e63faca1)",Project dependency,Git Submodule,Active,2025-12-23 15:57:14 +1030,3e63faca14674444020102c5a67cc4f9d6115005
runtm-coding-agent-runtime-control-plane,external/unsorted/runtm-coding-agent-runtime-control-plane,Other,Submodule,"Submodule at external/unsorted/runtm-coding-agent-runtime-control-plane (Version: heads/main)",Project dependency,Git Submodule,Active,2026-01-14 00:39:10 -0800,5a2d0a432148ef7e8f588efcac2ecd573ac3bb63
ryos,external/unsorted/ryos,Other,Submodule,"Submodule at external/unsorted/ryos (Version: v1.0.1-920-gae0673e8)",Project dependency,Git Submodule,Active,2026-01-12 20:06:42 +0000,ae0673e811dca70c8cda798c36a76d2e05783a32
ryot,external/unsorted/ryot,Other,Submodule,"Submodule at external/unsorted/ryot (Version: v10.1.1-5-g2bfd22c5)",Project dependency,Git Submodule,Active,2026-01-14 13:27:25 +0530,2bfd22c5b3daf2732cb720822b6a4adbdb7ffb74
selfhosted,external/unsorted/selfhosted,Other,Submodule,"Submodule at external/unsorted/selfhosted (Version: heads/master)",Project dependency,Git Submodule,Active,2026-01-13 04:21:41 +0100,9b273984239ab90376c534a5de717285bc27c904
showcode,external/unsorted/showcode,Other,Submodule,"Submodule at external/unsorted/showcode (Version: heads/main)",Project dependency,Git Submodule,Active,2026-01-04 23:27:36 +0530,ca0ce7964c2690e8fc4228441bd127c0afbff8f7
siara,external/unsorted/siara,Other,Submodule,"Submodule at external/unsorted/siara (Version: heads/main)",Project dependency,Git Submodule,Active,2026-01-02 18:00:21 +0500,d7744bfa47ba98f6531292a6f9272b6f054c62f0
siyuan,external/unsorted/siyuan,Other,Submodule,"Submodule at external/unsorted/siyuan (Version: v3.5.3)",Project dependency,Git Submodule,Active,2026-01-13 21:06:02 +0800,4ba64580c29c0782153f43c2c278e9bea431c7e0
skills-supply,external/unsorted/skills-supply,Other,Submodule,"Submodule at external/unsorted/skills-supply (Version: sk@0.2.4)",Project dependency,Git Submodule,Active,2026-01-12 18:17:20 -0500,89d22fe50732be479c758ac36db3594623906c99
software-agent-sdk,external/unsorted/software-agent-sdk,Other,Submodule,"Submodule at external/unsorted/software-agent-sdk (Version: 1.0.0-334-gef1c2dce)",Project dependency,Git Submodule,Active,2026-01-14 18:01:19 +0100,ef1c2dce89adba7e0b814c36fd75c2625a211b5e
sopro,external/unsorted/sopro,Other,Submodule,"Submodule at external/unsorted/sopro (Version: heads/main)",Project dependency,Git Submodule,Active,2026-01-07 21:15:25 +0000,482c207a48fbbb4287036ea1166be295ec6edd34
stabilize,external/unsorted/stabilize,Other,Submodule,"Submodule at external/unsorted/stabilize (Version: v0.11.1-6-g738b04f)",Project dependency,Git Submodule,Active,2026-01-13 23:19:50 +0000,738b04f7e6363c1f460fb15d9668d549f6611c23
subtask2,external/unsorted/subtask2,Other,Submodule,"Submodule at external/unsorted/subtask2 (Version: heads/main)",Project dependency,Git Submodule,Active,2026-01-04 02:22:12 +0100,d180d3e392dfda9ac0f22660ebbda8304a2e2127
thesis,external/unsorted/thesis,Other,Submodule,"Submodule at external/unsorted/thesis (Version: heads/main)",Project dependency,Git Submodule,Active,2026-01-14 01:24:48 +0200,ff743e09cd471720d2527fb072df430d2fca2570
ticket,external/unsorted/ticket,Other,Submodule,"Submodule at external/unsorted/ticket (Version: v0.2.0-10-ga21b540)",Project dependency,Git Submodule,Active,2026-01-14 12:11:35 -0500,a21b540a3c02c525753e07e2da7b5574e37174ba
tintcd,external/unsorted/tintcd,Other,Submodule,"Submodule at external/unsorted/tintcd (Version: heads/main)",Project dependency,Git Submodule,Active,2025-12-31 14:43:10 +0100,364c999a200b3c8d16122b00331ecbf13a6b512a
trello-mcp-server,external/unsorted/trello-mcp-server,Other,Submodule,"Submodule at external/unsorted/trello-mcp-server (Version: heads/main)",Project dependency,Git Submodule,Active,2025-04-23 11:09:29 +0800,8c0f867527d4e01f882ab896b9e77d9909daa861
triton-windowing,external/unsorted/triton-windowing,Other,Submodule,"Submodule at external/unsorted/triton-windowing (Version: heads/main)",Project dependency,Git Submodule,Active,2026-01-02 21:06:29 +0300,2ba7e9599b099359e9f57ef43f40132232832363
tui4j,external/unsorted/tui4j,Other,Submodule,"Submodule at external/unsorted/tui4j (Version: v0.1.1-84-g9d8b665)",Project dependency,Git Submodule,Active,2026-01-01 11:40:14 -0800,9d8b6658cabd7c75bcddfadc0d35d86cba05011c
turingmind-code-review,external/unsorted/turingmind-code-review,Other,Submodule,"Submodule at external/unsorted/turingmind-code-review (Version: heads/main)",Project dependency,Git Submodule,Active,2026-01-08 21:46:16 -0500,e939ab6fbc845aa6091260b1a855456babec7ae5
universal-session-viewer,external/unsorted/universal-session-viewer,Other,Submodule,"Submodule at external/unsorted/universal-session-viewer (Version: heads/main)",Project dependency,Git Submodule,Active,2026-01-04 09:04:44 -0700,e1f75ecd8a1af0dc86a8d635aa5e10cd1cc89749
vibe-kanban,external/unsorted/vibe-kanban,Other,Submodule,"Submodule at external/unsorted/vibe-kanban (Version: v0.0.152-20260114111222-7-gfbe61013)",Project dependency,Git Submodule,Active,2026-01-14 15:53:31 +0000,fbe61013b065b65a04e74fadfdd9e533dcb175d4
vibekit-nextjs-supabase,external/unsorted/vibekit-nextjs-supabase,Other,Submodule,"Submodule at external/unsorted/vibekit-nextjs-supabase (Version: heads/main)",Project dependency,Git Submodule,Active,2025-07-04 14:03:25 +0200,a9c9178576891ee5029c23cf12ef08b21adb1d7b
vibeproxy,external/unsorted/vibeproxy,Other,Submodule,"Submodule at external/unsorted/vibeproxy (Version: v1.8.50-1-g3fcc305)",Project dependency,Git Submodule,Active,2026-01-13 16:00:06 +0000,3fcc305a8d331f8ec3dea3103c7374433bbf42ff
vibesbench,external/unsorted/vibesbench,Other,Submodule,"Submodule at external/unsorted/vibesbench (Version: heads/main)",Project dependency,Git Submodule,Active,2026-01-12 19:45:13 +0530,0d5d8ef8ae0463fe0dbe138e6d614a5c84038109
vibesdk,external/unsorted/vibesdk,Other,Submodule,"Submodule at external/unsorted/vibesdk (Version: v1.4.0-35-gebe25a6)",Project dependency,Git Submodule,Active,2026-01-12 13:32:32 +0530,ebe25a6f50a98935d47d0caaa7d8d94f72ccf132
vibeship-spawner-skills,external/unsorted/vibeship-spawner-skills,Other,Submodule,"Submodule at external/unsorted/vibeship-spawner-skills (Version: heads/main)",Project dependency,Git Submodule,Active,2026-01-02 04:10:02 +0400,70b2e1062fc6a38fce854226c27097a87732cb5f
vibora,external/unsorted/vibora,Other,Submodule,"Submodule at external/unsorted/vibora (Version: v9.8.5)",Project dependency,Git Submodule,Active,2026-01-14 21:02:46 +0000,e44616fa951683f2b192f81f1fb3c20d69b45e89
video_explainer,external/unsorted/video_explainer,Other,Submodule,"Submodule at external/unsorted/video_explainer (Version: heads/main)",Project dependency,Git Submodule,Active,2026-01-13 16:06:09 -0800,66ac6c6791c07acadddb80b4293188c704ff2d94
voicemode,external/unsorted/voicemode,Other,Submodule,"Submodule at external/unsorted/voicemode (Version: v7.4.0-77-gf5bcce7)",Project dependency,Git Submodule,Active,2026-01-14 17:47:50 +1100,f5bcce749d1203ca282aa5104e10f505edeb17f5
void,external/unsorted/void,Other,Submodule,"Submodule at external/unsorted/void (Version: v1.3.4-11-g17e7a5b1)",Project dependency,Git Submodule,Active,2026-01-12 01:57:57 -0800,17e7a5b1524345b19ab4ee38ec4f9b1b75a1bd00
web-check,external/unsorted/web-check,Other,Submodule,"Submodule at external/unsorted/web-check (Version: 1.0.0-140-g62b3c88)",Project dependency,Git Submodule,Active,2026-01-13 16:08:18 +0000,62b3c88f5352e412fd874c0a3418ed56ef681483
webcli,external/unsorted/webcli,Other,Submodule,"Submodule at external/unsorted/webcli (Version: v0.1.0-5-g411e35b)",Project dependency,Git Submodule,Active,2026-01-09 12:28:59 -0300,411e35b39a947f225bcd429184d56c366e17be99
