name,path,category,role,description,rationale,integrationStrategy,status,date,commit
whatthefile,external/unsorted/whatthefile,Other,Submodule,"Submodule at external/unsorted/whatthefile (Version: v1.0.1)",Project dependency,Git Submodule,Active,2024-11-10 09:49:55 -0700,7ad79111b950cec47b58eb4e7c3ab392fffb094b
wip,external/unsorted/wip,Other,Submodule,"Submodule at external/unsorted/wip (Version: v0.1.12)",Project dependency,Git Submodule,Active,2026-01-09 02:42:47 +0100,2702b20212db24264297cdf47b19b52438982e7d
witr,external/unsorted/witr,Other,Submodule,"Submodule at external/unsorted/witr (Version: v0.2.4)",Project dependency,Git Submodule,Active,2026-01-14 18:46:05 +0000,3f57912996d63c3a557ccf7e09455b4b67cae885
workty,external/unsorted/workty,Other,Submodule,"Submodule at external/unsorted/workty (Version: v0.1.0-6-g5900554)",Project dependency,Git Submodule,Active,2026-01-06 16:51:37 +1100,590055453a428e97113c543367044a0fc3a51575
xpipe,external/unsorted/xpipe,Other,Submodule,"Submodule at external/unsorted/xpipe (Version: 20.3-13-g68e5ea61c)",Project dependency,Git Submodule,Active,2026-01-14 15:11:18 +0000,68e5ea61cca2b5b6598b3acd9652032e75c50c01
yolobox,external/unsorted/yolobox,Other,Submodule,"Submodule at external/unsorted/yolobox (Version: v0.1.0-17-gb520e3f)",Project dependency,Git Submodule,Active,2026-01-14 10:39:06 -0800,b520e3fa473532b93de6b2a821dbfcd983bd179c
zapret-discord-youtube,external/unsorted/zapret-discord-youtube,Other,Submodule,"Submodule at external/unsorted/zapret-discord-youtube (Version: 1.9.3-7-g874b681)",Project dependency,Git Submodule,Active,2026-01-12 19:44:26 +0300,874b6813a83f009947934a77a14a7ae6acacb3ea
zeroshot,external/unsorted/zeroshot,Other,Submodule,"Submodule at external/unsorted/zeroshot (Version: v5.3.0)",Project dependency,Git Submodule,Active,2026-01-12 23:24:03 +0000,8ce312bae8e024fc015ed3953930d62e25905f50
awesome-crypto-mcp,financial/crypto/awesome-crypto-mcp,Other,Submodule,"Submodule at financial/crypto/awesome-crypto-mcp (Version: heads/main)",Project dependency,Git Submodule,Active,2025-03-27 11:27:16 +0800,6f3db72a6f5e8cfe79e660868b4f9e6eaa67d5eb
coingecko-mcp,financial/crypto/coingecko-mcp,Other,Submodule,"Submodule at financial/crypto/coingecko-mcp (Version: v2.5.0)",Project dependency,Git Submodule,Active,2025-12-18 12:19:47 +0000,29d1d98913de42e4d9dfab4c4e5975930e8922c7
coinstats-mcp,financial/crypto/coinstats-mcp,Other,Submodule,"Submodule at financial/crypto/coinstats-mcp (Version: heads/main)",Project dependency,Git Submodule,Active,2025-08-15 17:28:44 +0400,98dd6669dbf59d025c8387a0070e4ef8da4efc7a
alpha_vantage_mcp,financial/mcp-servers/alpha_vantage_mcp,Other,Submodule,"Submodule at financial/mcp-servers/alpha_vantage_mcp (Version: heads/main)",Project dependency,Git Submodule,Active,2026-01-08 14:08:59 +0800,6d53f82786bd5e81587453a80ff6addd259c5688
financial-datasets-mcp,financial/mcp-servers/financial-datasets-mcp,Other,Submodule,"Submodule at financial/mcp-servers/financial-datasets-mcp (Version: heads/main)",Project dependency,Git Submodule,Active,2025-06-05 15:50:35 -0400,08e7a3dbb949d3d99bbd6d6f3a22e5f02973ec58
octagon-mcp-server,financial/mcp-servers/octagon-mcp-server,Other,Submodule,"Submodule at financial/mcp-servers/octagon-mcp-server (Version: heads/main)",Project dependency,Git Submodule,Active,2025-07-21 09:13:31 -0700,7f63fcea3a34450c656264e5e839c6ed7ad1f022
ai-hedge-fund,financial/trading/ai-hedge-fund,Other,Submodule,"Submodule at financial/trading/ai-hedge-fund (Version: heads/main)",Project dependency,Git Submodule,Active,2025-12-01 17:47:06 -0500,9adb980597677484e3cf44966323a0bb9a0455cb
trade-agent-mcp,financial/trading/trade-agent-mcp,Other,Submodule,"Submodule at financial/trading/trade-agent-mcp (Version: heads/main)",Project dependency,Git Submodule,Active,2025-12-15 23:35:24 -0500,473fc2cc2e45fc6738d957b5748812b07b0ded53
Kode-cli-2,frameworks/Kode-cli-2,Other,Submodule,"Submodule at frameworks/Kode-cli-2 (Version: heads/main)",Project dependency,Git Submodule,Active,2026-01-15 20:57:56 +0800,bf20ec789dc9a5c881f209d8b232629c02946fda
agent-console,mcp-dev-tools/agent-console,Other,Submodule,"Submodule at mcp-dev-tools/agent-console (Version: heads/main)",Project dependency,Git Submodule,Active,2025-12-30 10:26:04 -0800,0bbdaa7530ced86b7eb759a1ca4faedec8cb49ef
inspector,mcp-dev-tools/inspector,Other,Submodule,"Submodule at mcp-dev-tools/inspector (Version: v0.9.3-945-g58070915)",Project dependency,Git Submodule,Active,2025-12-29 10:10:23 -0800,58070915a6239403a402cc9872838b2958d8f61e
mcp-gearbox,mcp-dev-tools/mcp-gearbox,Other,Submodule,"Submodule at mcp-dev-tools/mcp-gearbox (Version: v0.0.6-20251120-122538-2-gf40a047)",Project dependency,Git Submodule,Active,2025-11-20 17:59:34 +0530,f40a047a9fdca949d6c52226fb681ef35be818cb
mcp-gearbox-cli,mcp-dev-tools/mcp-gearbox-cli,Other,Submodule,"Submodule at mcp-dev-tools/mcp-gearbox-cli (Version: v0.0.15-2-g3f2c52b)",Project dependency,Git Submodule,Active,2025-11-20 17:27:29 +0530,3f2c52bad476d7795aca7fb929bd6400c8cf070b
mcp-gearbox-js,mcp-dev-tools/mcp-gearbox-js,Other,Submodule,"Submodule at mcp-dev-tools/mcp-gearbox-js (Version: heads/main)",Project dependency,Git Submodule,Active,2025-11-11 08:18:22 +0000,f2d4798311e3fd9941335a110664cb4407193fca
mcp-router,mcp-dev-tools/mcp-router,Other,Submodule,"Submodule at mcp-dev-tools/mcp-router (Version: v0.6.1-5-g301f856)",Project dependency,Git Submodule,Active,2025-12-02 22:32:56 +0900,301f8561a95bb0e5c67c2fff3d3317b7bf1cf5a7
resterm,mcp-dev-tools/resterm,Other,Submodule,"Submodule at mcp-dev-tools/resterm (Version: v0.18.6)",Project dependency,Git Submodule,Active,2026-01-17 13:48:55 +0100,5917baa44fdff053cbdea8982012fd6e846e5c60
Polymcp,mcp-frameworks/Polymcp,Other,Submodule,"Submodule at mcp-frameworks/Polymcp (Version: heads/main)",Project dependency,Git Submodule,Active,2025-12-03 10:23:14 +0100,f2487d73d1661c2b2fe7a61e2ce1126b73f2f864
Super-MCP,mcp-frameworks/Super-MCP,Other,Submodule,"Submodule at mcp-frameworks/Super-MCP (Version: heads/main)",Project dependency,Git Submodule,Active,2025-12-08 12:13:54 +0000,cf8b782f5a64e944fbf36c1286591104ed42aea1
lazy-mcp,mcp-frameworks/lazy-mcp,Other,Submodule,"Submodule at mcp-frameworks/lazy-mcp (Version: v0.5.4-2-ga9928c8)",Project dependency,Git Submodule,Active,2025-10-15 10:25:20 -0700,a9928c8e00fbc6eef530d7d747427df75b5d32a6
mcp-use,mcp-frameworks/mcp-use,Other,Submodule,"Submodule at mcp-frameworks/mcp-use (Version: @mcp-use/cli@2.5.6-32-ge4c422e)",Project dependency,Git Submodule,Active,2025-12-19 10:55:28 +0100,e4c422e8612b7e41aa177b2566ac40bc408d223e
mcphub,mcp-hubs/mcphub,Other,Submodule,"Submodule at mcp-hubs/mcphub (Version: v0.11.4-1-gab7c210)",Project dependency,Git Submodule,Active,2025-12-07 13:11:35 +0800,ab7c2102819c3982f1135e6f4d37e555018186e1
metamcp,mcp-hubs/metamcp,Other,Submodule,"Submodule at mcp-hubs/metamcp (Version: v2.4.22-3-g95bf679)",Project dependency,Git Submodule,Active,2025-12-23 14:57:12 +0800,95bf679938a66764fe9cb0368dfd511d3de08c34
pluggedin-mcp,mcp-hubs/pluggedin-mcp,Other,Submodule,"Submodule at mcp-hubs/pluggedin-mcp (Version: v1.12.2-1-gc4b99ee)",Project dependency,Git Submodule,Active,2025-12-10 21:04:16 +0300,c4b99eeaa70e4dda8751eab98108f034a7797f26
agent-mcp-gateway,mcp-routers/agent-mcp-gateway,Other,Submodule,"Submodule at mcp-routers/agent-mcp-gateway (Version: v0.2.5)",Project dependency,Git Submodule,Active,2025-12-02 10:36:33 +1000,a1d664a4129bb6358b3cc9045f0095f2f32f127e
mcp-proxy,mcp-routers/mcp-proxy,Other,Submodule,"Submodule at mcp-routers/mcp-proxy (Version: v0.33.0-16-g6750aed)",Project dependency,Git Submodule,Active,2026-01-01 19:20:58 +0800,6750aedb4d2fbba5b32e029edff70b7e53ba07c3
mcpproxy,mcp-routers/mcpproxy,Other,Submodule,"Submodule at mcp-routers/mcpproxy (Version: heads/main)",Project dependency,Git Submodule,Active,2025-07-22 20:46:50 +0300,d43b27f0327e6449bfa6653196e247e22614ea66
mcpproxy-go,mcp-routers/mcpproxy-go,Other,Submodule,"Submodule at mcp-routers/mcpproxy-go (Version: v0.10.11-1-gf0ca376)",Project dependency,Git Submodule,Active,2025-12-09 16:38:52 +0200,f0ca376b371ecee98388e306049b523ae956f375
meta-mcp-proxy,mcp-routers/meta-mcp-proxy,Other,Submodule,"Submodule at mcp-routers/meta-mcp-proxy (Version: heads/main)",Project dependency,Git Submodule,Active,2025-05-13 16:59:20 -0300,6c10f1be28e03515c95ef86df07c11637bf52407
microsoft-mcp-gateway,mcp-routers/microsoft-mcp-gateway,Other,Submodule,"Submodule at mcp-routers/microsoft-mcp-gateway (Version: heads/main)",Project dependency,Git Submodule,Active,2026-01-15 11:37:12 -0800,5dbe5d6f6bbad1d6b20c553fa1c7c94150a97228
microsoft-mcp-gateway-2,mcp-routers/microsoft-mcp-gateway-2,Other,Submodule,"Submodule at mcp-routers/microsoft-mcp-gateway-2 (Version: heads/main)",Project dependency,Git Submodule,Active,2026-01-15 11:37:12 -0800,5dbe5d6f6bbad1d6b20c553fa1c7c94150a97228
ncp,mcp-routers/ncp,Other,Submodule,"Submodule at mcp-routers/ncp (Version: 2.0.1-10-g290845e)",Project dependency,Git Submodule,Active,2026-01-17 21:28:05 +0800,290845e3bef09f59d08c3e58660d36de9fb0b3d8
consult-llm-mcp,mcp-servers/ai/consult-llm-mcp,Other,Submodule,"Submodule at mcp-servers/ai/consult-llm-mcp (Version: v1.5.0)",Project dependency,Git Submodule,Active,2026-01-12 09:04:20 +0200,4769772fdb60788f55a1aa98733ea4a41273cce6
gemini-mcp-tool,mcp-servers/ai/gemini-mcp-tool,Other,Submodule,"Submodule at mcp-servers/ai/gemini-mcp-tool (Version: v1.1.2-10-gef11fab)",Project dependency,Git Submodule,Active,2025-07-23 02:37:50 +0000,ef11fab07b28170c81a95f2e277c51c5fb459546
mcp-server-deep-research,mcp-servers/ai/mcp-server-deep-research,Other,Submodule,"Submodule at mcp-servers/ai/mcp-server-deep-research (Version: heads/main)",Project dependency,Git Submodule,Active,2025-03-25 08:50:11 -0700,640129a84d09543338f725cdc6b5a7ed204d140b
mcp-server-gemini,mcp-servers/ai/mcp-server-gemini,Other,Submodule,"Submodule at mcp-servers/ai/mcp-server-gemini (Version: heads/main)",Project dependency,Git Submodule,Active,2025-07-14 21:51:42 +0300,d90346a45bf89088944063a03c95904bfc3b833f
mcp-zen,mcp-servers/ai/mcp-zen,Other,Submodule,"Submodule at mcp-servers/ai/mcp-zen (Version: heads/main)",Project dependency,Git Submodule,Active,2025-06-14 05:21:59 +0100,60e03b0e430fd60e8aae2ba9b94fda10c7b43b8e
notebooklm-mcp,mcp-servers/ai/notebooklm-mcp,Other,Submodule,"Submodule at mcp-servers/ai/notebooklm-mcp (Version: v1.3.6-6-g5ba9714)",Project dependency,Git Submodule,Active,2025-12-13 04:33:09 -0500,5ba9714ab598cb87610d17f2eb570e96994406e1
algonius-browser,mcp-servers/browser/algonius-browser,Other,Submodule,"Submodule at mcp-servers/browser/algonius-browser (Version: heads/master)",Project dependency,Git Submodule,Active,2025-06-25 22:30:31 +0800,ae03e6a0cd30f08c06422f911e85cdfc90495d2a
algonius-browser-2,mcp-servers/browser/algonius-browser-2,Other,Submodule,"Submodule at mcp-servers/browser/algonius-browser-2 (Version: v0.2.0-94-gae03e6a)",Project dependency,Git Submodule,Active,2025-06-25 22:30:31 +0800,ae03e6a0cd30f08c06422f911e85cdfc90495d2a
algonius-browser-3,mcp-servers/browser/algonius-browser-3,Other,Submodule,"Submodule at mcp-servers/browser/algonius-browser-3 (Version: heads/master)",Project dependency,Git Submodule,Active,2025-06-25 22:30:31 +0800,ae03e6a0cd30f08c06422f911e85cdfc90495d2a
algonius-browser-4,mcp-servers/browser/algonius-browser-4,Other,Submodule,"Submodule at mcp-servers/browser/algonius-browser-4 (Version: heads/master)",Project dependency,Git Submodule,Active,2025-06-25 22:30:31 +0800,ae03e6a0cd30f08c06422f911e85cdfc90495d2a
chrome-devtools-mcp,mcp-servers/browser/chrome-devtools-mcp,Other,Submodule,"Submodule at mcp-servers/browser/chrome-devtools-mcp (Version: chrome-devtools-mcp-v0.12.1-7-g914ac68)",Project dependency,Git Submodule,Active,2026-01-02 13:23:46 +0100,914ac682a24d5a5cb8bfc4e878b3f5d713d371f7
clickclickclick,mcp-servers/browser/clickclickclick,Other,Submodule,"Submodule at mcp-servers/browser/clickclickclick (Version: heads/main)",Project dependency,Git Submodule,Active,2025-10-05 01:07:07 +0530,6f18cd8bd6c7bffb8448ce5ffbd04a9d42c58fdb
computer-control-mcp,mcp-servers/browser/computer-control-mcp,Other,Submodule,"Submodule at mcp-servers/browser/computer-control-mcp (Version: heads/main)",Project dependency,Git Submodule,Active,2025-12-19 12:27:17 +0600,89476148d80ac37d9c157fcd09249daaf106312d
cua,mcp-servers/browser/cua,Other,Submodule,"Submodule at mcp-servers/browser/cua (Version: heads/main)",Project dependency,Git Submodule,Active,2026-01-13 16:16:38 -0800,afec1fefb55d577d7ef1215d792256b681c7e4fe
fara,mcp-servers/browser/fara,Other,Submodule,"Submodule at mcp-servers/browser/fara (Version: heads/main)",Project dependency,Git Submodule,Active,2025-12-15 11:33:48 -0500,6261cdb6fc381cb518e0b80d976e226149bc9f31
generalagents-python,mcp-servers/browser/generalagents-python,Other,Submodule,"Submodule at mcp-servers/browser/generalagents-python (Version: v0.1.1)",Project dependency,Git Submodule,Active,2025-04-11 14:55:51 -0700,d36f6a858685fb1d7842b6f05c8af501130f8efc
playwright-mcp,mcp-servers/browser/playwright-mcp,Other,Submodule,"Submodule at mcp-servers/browser/playwright-mcp (Version: v0.0.54-1-gdba2fd0)",Project dependency,Git Submodule,Active,2025-12-30 17:57:46 -0800,dba2fd054de4ebf3d3096a19d7bfdcaa6d62b14d
spark-mcp,mcp-servers/browser/spark-mcp,Other,Submodule,"Submodule at mcp-servers/browser/spark-mcp (Version: heads/claude/bytebot-mcp-server-01EeujB7JsCc5NqfrnbWM2oQ)",Project dependency,Git Submodule,Active,2025-11-22 07:49:42 +0000,6b1eb66bebcf2aa938da2e05315d0654984581e1
Upsonic,mcp-servers/financial/Upsonic,Other,Submodule,"Submodule at mcp-servers/financial/Upsonic (Version: v0.69.3)",Project dependency,Git Submodule,Active,2025-12-25 18:40:37 +0300,a76cab5642e8884cb28f613b343e7e39e28f2ea8
ai-hedge-fund,mcp-servers/financial/ai-hedge-fund,Other,Submodule,"Submodule at mcp-servers/financial/ai-hedge-fund (Version: heads/main)",Project dependency,Git Submodule,Active,2025-12-01 17:47:06 -0500,9adb980597677484e3cf44966323a0bb9a0455cb
alpha_vantage_mcp,mcp-servers/financial/alpha_vantage_mcp,Other,Submodule,"Submodule at mcp-servers/financial/alpha_vantage_mcp (Version: heads/main)",Project dependency,Git Submodule,Active,2026-01-08 14:08:59 +0800,6d53f82786bd5e81587453a80ff6addd259c5688
binance-mcp-server,mcp-servers/financial/binance-mcp-server,Other,Submodule,"Submodule at mcp-servers/financial/binance-mcp-server (Version: heads/main)",Project dependency,Git Submodule,Active,2025-12-21 20:02:50 +0900,e6f1582cbdcda3dcf9bfebc9a40eb7f8c9f06fd0
coingecko-typescript,mcp-servers/financial/coingecko-typescript,Other,Submodule,"Submodule at mcp-servers/financial/coingecko-typescript (Version: v2.5.0)",Project dependency,Git Submodule,Active,2025-12-18 12:19:47 +0000,29d1d98913de42e4d9dfab4c4e5975930e8922c7
financial-datasets-mcp,mcp-servers/financial/financial-datasets-mcp,Other,Submodule,"Submodule at mcp-servers/financial/financial-datasets-mcp (Version: heads/main)",Project dependency,Git Submodule,Active,2025-06-05 15:50:35 -0400,08e7a3dbb949d3d99bbd6d6f3a22e5f02973ec58
octagon-mcp-server,mcp-servers/financial/octagon-mcp-server,Other,Submodule,"Submodule at mcp-servers/financial/octagon-mcp-server (Version: heads/main)",Project dependency,Git Submodule,Active,2025-07-21 09:13:31 -0700,7f63fcea3a34450c656264e5e839c6ed7ad1f022
trade-agent-mcp,mcp-servers/financial/trade-agent-mcp,Other,Submodule,"Submodule at mcp-servers/financial/trade-agent-mcp (Version: heads/main)",Project dependency,Git Submodule,Active,2025-12-15 23:35:24 -0500,473fc2cc2e45fc6738d957b5748812b07b0ded53
youtube-video-summarizer-mcp,mcp-servers/media/youtube-video-summarizer-mcp,Other,Submodule,"Submodule at mcp-servers/media/youtube-video-summarizer-mcp (Version: heads/main)",Project dependency,Git Submodule,Active,2025-11-21 19:23:34 +0600,d682eb958544a4a9b1aaff4414be11a8870b9cfe
chroma-mcp,mcp-servers/memory/chroma-mcp,Other,Submodule,"Submodule at mcp-servers/memory/chroma-mcp (Version: v0.2.0-14-g98ff675)",Project dependency,Git Submodule,Active,2025-09-17 13:20:13 -0700,98ff67589bdcc31b730a5415ff9529433f949077
mcp-context-forge,mcp-servers/memory/mcp-context-forge,Other,Submodule,"Submodule at mcp-servers/memory/mcp-context-forge (Version: v1.0.0-BETA-1-95-g7525bb30)",Project dependency,Git Submodule,Active,2026-01-02 11:55:55 +0000,7525bb30e898e213c699ff1d2e33717d659f9f46
mcp-mem0,mcp-servers/memory/mcp-mem0,Other,Submodule,"Submodule at mcp-servers/memory/mcp-mem0 (Version: heads/main)",Project dependency,Git Submodule,Active,2025-04-12 20:17:13 -0500,22fb7af0432e15fbe379ad7c7c7beac911fa2648
mem0-mcp,mcp-servers/memory/mem0-mcp,Other,Submodule,"Submodule at mcp-servers/memory/mem0-mcp (Version: heads/main)",Project dependency,Git Submodule,Active,2025-12-07 22:54:13 +0530,b53a1f327032352f730a5df0461a2f597892a843
vibememo,mcp-servers/memory/vibememo,Other,Submodule,"Submodule at mcp-servers/memory/vibememo (Version: heads/main)",Project dependency,Git Submodule,Active,2025-12-05 00:57:47 -0300,a0a3aea5bc33b4e8f0a6e9037fc3a3bd68920b91
chgpt-mcp-bridge,mcp-servers/misc/chgpt-mcp-bridge,Other,Submodule,"Submodule at mcp-servers/misc/chgpt-mcp-bridge (Version: heads/main)",Project dependency,Git Submodule,Active,2025-12-04 15:41:22 +0100,d99e46d42d6866e3ce089dc02b59b516a9fa967a
wot-mcp,mcp-servers/misc/wot-mcp,Other,Submodule,"Submodule at mcp-servers/misc/wot-mcp (Version: heads/main)",Project dependency,Git Submodule,Active,2025-12-17 17:12:05 +0100,0a325ac1c48868ddc9a7a03978653487f71489fc
wot-mcp-cli,mcp-servers/misc/wot-mcp-cli,Other,Submodule,"Submodule at mcp-servers/misc/wot-mcp-cli (Version: heads/main)",Project dependency,Git Submodule,Active,2025-12-17 17:09:45 +0100,dbce3b34b7ababcd0e7e110bc489c5726858b824
wot-mcp-examples,mcp-servers/misc/wot-mcp-examples,Other,Submodule,"Submodule at mcp-servers/misc/wot-mcp-examples (Version: heads/main)",Project dependency,Git Submodule,Active,2025-12-17 17:07:54 +0100,4f7b4511235c3be8089ca4bbbc5188020b378d33
mcp-tool-chainer,mcp-servers/orchestration/mcp-tool-chainer,Other,Submodule,"Submodule at mcp-servers/orchestration/mcp-tool-chainer (Version: heads/main)",Project dependency,Git Submodule,Active,2025-08-04 17:44:02 +0100,84ab8539cde79cf9b3df4128a37b63498d5dd53e
vibe-check-mcp-server,mcp-servers/oversight/vibe-check-mcp-server,Other,Submodule,"Submodule at mcp-servers/oversight/vibe-check-mcp-server (Version: v2.7.6-2-g3b94a24)",Project dependency,Git Submodule,Active,2025-11-06 22:51:24 +0530,3b94a2424b2afd8ba84e6387e1147a48a5e1b6d2
DesktopCommanderMCP,mcp-servers/search/DesktopCommanderMCP,Other,Submodule,"Submodule at mcp-servers/search/DesktopCommanderMCP (Version: heads/main)",Project dependency,Git Submodule,Active,2026-01-12 11:27:08 +0200,507081ebe099cf38bb35b717b2aa2af67bb679dd
mcp-everything-search,mcp-servers/search/mcp-everything-search,Other,Submodule,"Submodule at mcp-servers/search/mcp-everything-search (Version: heads/main)",Project dependency,Git Submodule,Active,2025-10-21 05:36:32 +0800,0d46c1b0159a91ff54cce54906d55a6dba18e776
mindsdb,mcp-servers/search/mindsdb,Other,Submodule,"Submodule at mcp-servers/search/mindsdb (Version: heads/main)",Project dependency,Git Submodule,Active,2026-01-09 15:24:20 -0800,8f56e5cb6ebee115615db0acbb077e54ee9572ed
sourcerer-mcp,mcp-servers/search/sourcerer-mcp,Other,Submodule,"Submodule at mcp-servers/search/sourcerer-mcp (Version: v0.5.5)",Project dependency,Git Submodule,Active,2025-11-10 20:34:29 +0300,5839e64fadf633452c40ffb71a31d337aa3179d5
web-search-mcp,mcp-servers/search/web-search-mcp,Other,Submodule,"Submodule at mcp-servers/search/web-search-mcp (Version: heads/main)",Project dependency,Git Submodule,Active,2025-08-08 20:58:45 +0100,eeb03f88525cbf74c4019e59a3fea45a537a760b
lootbox,mcp-tool-rag/lootbox,Other,Submodule,"Submodule at mcp-tool-rag/lootbox (Version: heads/main)",Project dependency,Git Submodule,Active,2025-12-06 13:23:25 -0600,0e8fc1b479695b33673136dca895b1dc5fdd6718
mcp-funnel,mcp-tool-rag/mcp-funnel,Other,Submodule,"Submodule at mcp-tool-rag/mcp-funnel (Version: heads/develop)",Project dependency,Git Submodule,Active,2025-11-24 18:13:25 +0100,12d44ef1fcbe97156c4dbd2996e136b3c2053f44
Claude-Matrix,memory/Claude-Matrix,Other,Submodule,"Submodule at memory/Claude-Matrix (Version: heads/main)",Project dependency,Git Submodule,Active,2026-01-17 15:53:49 -0300,31b3699f93b441abc941d797bebb3e6ddf8d59d6
adk-js,memory/adapters/adk-js,Other,Submodule,"Submodule at memory/adapters/adk-js (Version: v0.2.4)",Project dependency,Git Submodule,Active,2026-01-16 16:57:25 -0800,96a6d75f2a32d703b08df7e9d22c2f0f4f13778d
mcp-obsidian-notes,memory/mcp-obsidian-notes,Other,Submodule,"Submodule at memory/mcp-obsidian-notes (Version: heads/master)",Project dependency,Git Submodule,Active,2026-01-15 18:35:40 +0100,eb4d2265564717b6172f2e1cb9527ca58a3f66b9
mcp-obsidian-notes-2,memory/mcp-obsidian-notes-2,Other,Submodule,"Submodule at memory/mcp-obsidian-notes-2 (Version: heads/master)",Project dependency,Git Submodule,Active,2026-01-15 18:35:40 +0100,eb4d2265564717b6172f2e1cb9527ca58a3f66b9
deepcontext-mcp,memory/mcp-servers/deepcontext-mcp,Other,Submodule,"Submodule at memory/mcp-servers/deepcontext-mcp (Version: heads/main)",Project dependency,Git Submodule,Active,2025-09-22 16:35:49 -0700,81805178ba419c9e2f7a97e82bfd14a78a7a476d
mcp-automem,memory/mcp-servers/mcp-automem,Other,Submodule,"Submodule at memory/mcp-servers/mcp-automem (Version: v0.10.0)",Project dependency,Git Submodule,Active,2026-01-07 00:20:44 +0100,663d5988b42d93398fdedde0d43dbcee8fd14e3a
mcp-memory-service,memory/mcp-servers/mcp-memory-service,Other,Submodule,"Submodule at memory/mcp-servers/mcp-memory-service (Version: v8.76.0)",Project dependency,Git Submodule,Active,2026-01-12 18:13:13 +0100,fc44bfcf2199daef83315860d5c1a6aa2db81c58
mcp-servers-official,memory/mcp-servers/mcp-servers-official,Other,Submodule,"Submodule at memory/mcp-servers/mcp-servers-official (Version: heads/main)",Project dependency,Git Submodule,Active,2026-01-10 18:26:12 -0700,861c11b786b3efbc87eb2e878a4039d33846a031
qdrant-mcp,memory/mcp-servers/qdrant-mcp,Other,Submodule,"Submodule at memory/mcp-servers/qdrant-mcp (Version: v0.8.1)",Project dependency,Git Submodule,Active,2025-12-10 11:21:54 +0100,860ab93a96ca9f5e6cf6fe47e2f5b75d36eaac69
supermemory-mcp,memory/mcp-servers/supermemory-mcp,Other,Submodule,"Submodule at memory/mcp-servers/supermemory-mcp (Version: heads/master)",Project dependency,Git Submodule,Active,2025-12-30 12:05:48 -0800,84f5dc9f1cf077ba753decbf56805205b5c0443a
memora,memory/memora,Other,Submodule,"Submodule at memory/memora (Version: heads/main)",Project dependency,Git Submodule,Active,2026-01-12 00:57:39 +0200,f17e33bebceff52092ae0b058a44bfb301914b04
opencode-plugin-simple-memory,memory/plugins/opencode-plugin-simple-memory,Other,Submodule,"Submodule at memory/plugins/opencode-plugin-simple-memory (Version: heads/main)",Project dependency,Git Submodule,Active,2025-12-15 21:47:25 +0200,5ac3fb0af7f9e5a1d2486915a42c717c818c5a33
cognee,memory/systems-refs/cognee,Other,Submodule,"Submodule at memory/systems-refs/cognee (Version: v0.5.0.dev0-233-g5b42b21a)",Project dependency,Git Submodule,Active,2025-12-29 18:00:08 +0100,5b42b21af5da44866d6950141aaf672fffa776ca
letta,memory/systems-refs/letta,Other,Submodule,"Submodule at memory/systems-refs/letta (Version: 0.1.15-6362-ge026bef80)",Project dependency,Git Submodule,Active,2025-12-18 15:52:27 -0800,e026bef80fc8e89298681a044ae852683a47ce4d
txtai,memory/systems-refs/txtai,Other,Submodule,"Submodule at memory/systems-refs/txtai (Version: v3.3.0-1420-g995428d)",Project dependency,Git Submodule,Active,2025-12-24 10:06:32 -0500,995428d96c8a647e21014669f9d76fa4fd8f9806
Claude-Matrix,memory/systems/Claude-Matrix,Other,Submodule,"Submodule at memory/systems/Claude-Matrix (Version: heads/main)",Project dependency,Git Submodule,Active,2026-01-13 18:48:23 -0300,cd253e81218fdc7fbae823fab6865b9136449b76
CodeWeaver,memory/systems/CodeWeaver,Other,Submodule,"Submodule at memory/systems/CodeWeaver (Version: heads/main)",Project dependency,Git Submodule,Active,2025-12-04 12:05:47 +0000,54225b3370d0b50a3cd828b8eb3cc97d2df321b4
Context-Engine,memory/systems/Context-Engine,Other,Submodule,"Submodule at memory/systems/Context-Engine (Version: heads/main)",Project dependency,Git Submodule,Active,2025-12-11 15:40:19 -0600,2b22d04f6df58bb7abe8df94012ad31839418791
Long-Term-Memory-API,memory/systems/Long-Term-Memory-API,Other,Submodule,"Submodule at memory/systems/Long-Term-Memory-API (Version: heads/main)",Project dependency,Git Submodule,Active,2025-12-17 09:21:44 +0000,00a71193475dc3bbbbbcbaceb32dae7ce6a7c621
MemMachine,memory/systems/MemMachine,Other,Submodule,"Submodule at memory/systems/MemMachine (Version: heads/main)",Project dependency,Git Submodule,Active,2026-01-14 15:28:13 +0800,123b33bbcc54cb60d4aa2c560f8599be63ff4101
Memori,memory/systems/Memori,Other,Submodule,"Submodule at memory/systems/Memori (Version: heads/main)",Project dependency,Git Submodule,Active,2026-01-12 14:41:07 -0600,2e44d67d0973b78449ee0e8a1a3cba25d1219d35
MemoryOS,memory/systems/MemoryOS,Other,Submodule,"Submodule at memory/systems/MemoryOS (Version: heads/main)",Project dependency,Git Submodule,Active,2025-09-20 13:08:48 +0800,d7a546274877429fa23912baac4cc6ad773b6dd6
Mimir,memory/systems/Mimir,Other,Submodule,"Submodule at memory/systems/Mimir (Version: heads/main)",Project dependency,Git Submodule,Active,2025-12-25 03:32:03 -0700,01c0203d447ab4f6e04aa15d0c830d92bd4f2749
OpenMemory,memory/systems/OpenMemory,Other,Submodule,"Submodule at memory/systems/OpenMemory (Version: heads/main)",Project dependency,Git Submodule,Active,2026-01-11 14:58:08 +0530,c7fc7e1159b346c951ab8242caed72dbbb7ca054
automem,memory/systems/automem,Other,Submodule,"Submodule at memory/systems/automem (Version: heads/main)",Project dependency,Git Submodule,Active,2026-01-10 05:55:23 +0100,14491c47ea78729d03cd36390cda67f3cc70670a
